ID,committee name
426,"YES ON B, SAN FRANCISCANS FOR CLEAN AND SAFE NEIGHBORHOOD PARKS, WITH MAJOR SUPPORT FROM SAN FRANCISCO PARKS ALLIANCE, RON CONWAY AND THE TRUST FOR PUBLIC LAND"
427,"Yes on C, Alcatraz Conversion Project"
428,"Yes on E, San Franciscans for Ballot Measure Reform, Supported by Supervisor Scott Wiener"
429,"Yes on K, Committee United for Safety and Protection"
430,Yes on Measure A 2010
431,Yes on Measure B for Safer San Francisco Streets - San Francisco Police Officers Association
432,Yes on Measure H 2010
433,Yes on Prop A - Committee for Safe Schools
434,"YES ON PROP B PENSION & BENEFITS REFORM, Supported by Public Defender Jeff Adachi, Harriet Heyman, Michael Moritz and Warren Hellman."
435,Yes on Prop D
436,Yes on Prop K. ORG
437,"Yes on Proposition A, Let's Rebuild San Francisco's Schools funded in part by a Citizen interested in improving education in San Francisco public schools"
438,"YES ON PROPOSITION B, supported by Public Defender Jeff Adachi, author Harriet Heyman, business investors Michael Moritz & Warren Hellman, Basic American Goods executives…(Complete Name See Form 410)"
439,"Yes on Proposition D, supported by Public Defender Jeff Adachi, Basic American Foods executive George Hume & business investor Michael Moritz"
440,Yes on Proposition G 2011 (see additional page for full committe name)
441,"Yes on Proposition G 2011, a Committee in Support of Public Safety, Children, and Seniors, Supported by SEIU United Healthcare Workers West Political Issues Committee"
442,Yes on Proposition G San Francisco
443,"Yosemite Restoration Campaign - Yes on F, sponsored by Restore Hetch Hetchy"
444,"Yosemite Restoration Campaign, sponsored by Restore Hetch Hetchy"
